{
  "artifact": null,
  "componentDetails": {
    "backend": {
      "commit": "755c511539fe561207ca38ff5079f471a4110896",
      "version": "0.1.0"
    },
    "gazebo": {
      "aptKeySha256": "15d0300460e0c9c0efb21fa9770c0bf228988a07d71c4fac985c2161954a25a4",
      "packageVersion": "1.0.0-1~noble",
      "release": "harmonic"
    },
    "mavsdk": {
      "version": "3.15.3"
    },
    "px4": {
      "commit": "6ea3539157ca358c70a515878b77077af7d4611d",
      "version": "v1.16.0"
    },
    "python": {
      "version": "3.12"
    },
    "pyulog": {
      "version": "1.2.3"
    },
    "ubuntu": {
      "image": "ubuntu:24.04@sha256:52df9b1ee71626e0088f7d400d5c6b5f7bb916f8f0c82b474289a4ece6cf3faf",
      "indexDigest": "sha256:4fbb8e6a8395de5a7550b33509421a2bafbc0aab6c06ba2cef9ebffbc7092d90"
    },
    "valkey": {
      "commit": "5f4bae3ea10174a7c872cc099c953b0e91afa93a",
      "version": "8.1.4"
    },
    "worker": {
      "commit": "755c511539fe561207ca38ff5079f471a4110896",
      "version": "0.1.0"
    }
  },
  "components": {
    "backend": "0.1.0",
    "gazebo": "harmonic@1.0.0-1~noble",
    "px4": "v1.16.0@6ea3539157ca"
  },
  "locks": {
    "pinsSha256": "4e0d095295b181390c8942f067307c342d42f06cc58ae30f1cb415e400136cf5",
    "pythonRequirementsSha256": "b980831bf81726181aa7a951038ec652e44f868144383c2747a6857b6d421607"
  },
  "runtimeId": "c75ae324-c247-50b5-bd74-fa8325e9e616",
  "schemaVersion": 1,
  "smokeReport": {
    "checks": [
      {
        "durationSeconds": 1,
        "name": "component_versions",
        "passed": true
      },
      {
        "durationSeconds": 1,
        "name": "python_imports",
        "passed": true
      },
      {
        "durationSeconds": 0,
        "name": "valkey_ping",
        "passed": true
      },
      {
        "durationSeconds": 0,
        "name": "api_worker_heartbeat",
        "passed": true
      },
      {
        "durationSeconds": 1,
        "name": "real_cli_dry_run",
        "passed": true
      },
      {
        "durationSeconds": 15,
        "name": "px4_gazebo_headless",
        "passed": true
      },
      {
        "durationSeconds": 0,
        "name": "parameter_readback",
        "passed": true
      }
    ],
    "completedAt": "2026-07-29T02:35:51.125487+00:00",
    "imageId": "sha256:046ab326c5ef363bbf97c9835dde82a4e71490ea1c6a60f0be76e0c312005d18",
    "mode": "runtime-image",
    "passed": true,
    "runtimeId": "c75ae324-c247-50b5-bd74-fa8325e9e616"
  },
  "smokeTests": {
    "gazebo": true,
    "parameterReadback": true,
    "px4Sitl": true
  },
  "source": {
    "droneDreamCommit": "755c511539fe561207ca38ff5079f471a4110896"
  },
  "target": {
    "arch": "amd64",
    "codename": "noble",
    "format": "wsl2-rootfs-tar",
    "os": "ubuntu",
    "version": "24.04"
  },
  "version": "0.1.0"
}
